{
  "id": "serve-and-volley",
  "name": "发球上网",
  "category": "发球战术",
  "introduction": "用外角发球拉开接发人，随发球直接上网，在网前截击封线路完成得分，是经典的全场压制打法。",
  "purpose": "发球抢占主动后立刻上网压缩对手回球反应时间，用截击直接终结这一分，同时向对手施加接发心理压力。",
  "scenarios": "一发成功率高的发球局；草地、快速硬地等低弹跳场地；对手接发站位靠后、回球速度偏慢时。",
  "tips": "发球后第一反应是向前分腿垫步，不要停下来欣赏发球；截击优先封直线（对手最顺畅的回球线路）；一发成功率低时慎用，二发上网风险很大。",
  "protocolVersion": "1.0",
  "script": {
    "meta": {
      "id": "serve-and-volley-v1",
      "name": "发球上网",
      "description": "外角发球拉开对手，随球上网，网前截击封直线制胜",
      "duration": 3750,
      "version": "1.0",
      "author": "tennis_tactic"
    },
    "court": {
      "width": 720,
      "height": 1280,
      "surfaceColor": "#1F5D3B",
      "lineColor": "#FFFFFF",
      "courtRect": { "x": 80, "y": 40, "w": 560, "h": 1200 },
      "netPosition": 640
    },
    "elements": [
      { "id": "attacker", "type": "player", "label": "我方", "color": "#1565C0", "radius": 18, "initPos": [400, 1230] },
      { "id": "defender", "type": "player", "label": "对手", "color": "#C62828", "radius": 18, "initPos": [360, 50] },
      { "id": "ball", "type": "ball", "label": "", "color": "#CCFF00", "radius": 6, "initPos": [400, 1230] }
    ],
    "timeline": [
      {
        "t": 0,
        "actions": [
          { "type": "text", "content": "外角发球，拉开对手接发位置", "pos": [80, 1100], "dur": 800, "style": { "fontSize": 16, "color": "#FFFFFF", "bg": "rgba(21,101,192,0.8)" } },
          { "type": "trajectory", "target": "ball", "waypoints": [[400, 1230], [570, 640], [535, 390]], "curve": "catmullrom", "dur": 700, "easing": "linear", "showBounceMark": false }
        ]
      },
      {
        "t": 600,
        "actions": [
          { "type": "move", "target": "defender", "from": [360, 50], "to": [530, 300], "dur": 700, "easing": "easeInOutQuad" }
        ]
      },
      {
        "t": 1500,
        "actions": [
          { "type": "text", "content": "对手伸展勉强回球，质量不高", "pos": [80, 1060], "dur": 800, "style": { "fontSize": 16, "color": "#FFFFFF", "bg": "rgba(198,40,40,0.8)" } },
          { "type": "trajectory", "target": "ball", "waypoints": [[535, 340], [480, 640], [450, 860]], "curve": "catmullrom", "dur": 650, "easing": "linear", "showBounceMark": false },
          { "type": "move", "target": "attacker", "from": [400, 1230], "to": [420, 800], "dur": 900, "easing": "easeInOutQuad" },
          { "type": "move", "target": "defender", "from": [530, 300], "to": [430, 200], "dur": 800, "easing": "easeInOutQuad" }
        ]
      },
      {
        "t": 2450,
        "actions": [
          { "type": "text", "content": "网前截击封线路，直接得分！", "pos": [80, 1060], "dur": 1000, "style": { "fontSize": 18, "color": "#FFFFFF", "bg": "rgba(21,101,192,0.9)" } },
          { "type": "trajectory", "target": "ball", "waypoints": [[430, 820], [330, 650], [170, 200]], "curve": "catmullrom", "dur": 500, "easing": "linear", "showBounceMark": true }
        ]
      }
    ]
  }
}
